{
  "$schema": "https://json-schema.org/draft/2020-12/schema",
  "title": "retarget_report",
  "type": "object",
  "required": [
    "schema_version",
    "plan_id",
    "avatar_id",
    "status",
    "generated_at_utc"
  ],
  "properties": {
    "schema_version": {"type": "integer"},
    "plan_id": {"type": "string"},
    "avatar_id": {"type": "string"},
    "status": {"type": "string"},
    "backend": {"type": "object"},
    "sequence_reports": {"type": "array"},
    "summary": {"type": "object"},
    "generated_at_utc": {"type": "string"}
  }
}

