{
  "schema_version": 1,
  "plan_id": "demo_song_plan",
  "avatar_id": "reference_avatar",
  "status": "backend_unavailable",
  "backend": {
    "name": "blender",
    "available": false
  },
  "sequence_reports": [],
  "summary": {
    "sequence_count": 0
  },
  "generated_at_utc": "2026-04-02T00:00:00+00:00"
}

